{
    "id": "beat-rings",
    "name": "Beat Rings",
    "version": "1.0.0",
    "apiVersion": "^1.0.0",
    "description": "Concentric rings that pulse to audio — example of multi-object audio-reactive rendering",
    "author": "Your Name",
    "elements": [
        {
            "type": "beat-rings",
            "entry": "beat-rings.ts"
        }
    ]
}
