{
    "id": "falling-notes",
    "name": "Falling Notes",
    "version": "1.0.0",
    "apiVersion": "^1.0.0",
    "description": "MIDI notes fall toward a now-line, piano-roll style — example of timeline API and time-based layout",
    "author": "Your Name",
    "elements": [
        {
            "type": "falling-notes",
            "entry": "falling-notes.ts"
        }
    ]
}
