{
    "id": "us.maok.fnf",
    "name": "Fnf",
    "version": "1.0.0",
    "apiVersion": "^1.0.0",
    "description": "Friday night funkin looks kind of strange today doesn't it?",
    "author": "Your Name",
    "elements": [
        {
            "type": "boyfriend",
            "entry": "boyfriend.ts"
        },
        {
            "type": "arrows",
            "entry": "arrows.ts"
        }
    ]
}
